profID,Full Name,Email,profile_link,research_keywords,biography,researchinterests,current_projects,personal_websites,orcid,scopus,DBLP_profile_link,citation_graph,dplp_creation_date,other_urls,aliases,affiliations,scholar_id,url_picture,citedby,citedby5y,hindex,hindex5y,i10index,i10index5y,cites_per_year
0,A S Madhukumar,asmadhukumar@ntu.edu.sg,/cris/rp/rp00083,"['Computer Science and Engineering', 'Electrical and Electronic Engineering', 'Info-Communication Technology', 'Interactive Digital Media', 'Internet & Communications', 'Computer Networks and Communications']","AS Madhukumar’s expertise lies in the areas of multi-tier cellular architecture, cooperative and cognitive radio systems, interference management, coding and modulation, new multiple access schemes, hybrid radio systems and other advanced signal processing algorithms for future communication systems. He is involved in a number of funded research projects, organizing international conferences, and a permanent reviewer for many internationally reputed journals and conferences. He has published over 300 referred international conference and journal papers. He is a recipient of Nanyang Award for Teaching Excellence in 2007 and obtained best paper awards in IEEE 35th Digital Avionics Conference in 2016 and in IEEE Integrated Communications, Navigations and Surveillance Conference in 2016 and in 2017. A S Madhukumar received his B Tech degree from College of Engineering, Trivandrum, India, M Tech from Cochin University of Science and Technology, India and Ph D from Department of Computer Science and Engineering, Indian Institute of Technology, Madras, India. He is currently an Associate Professor in the School of Computer Engineering, Nanyang Technological University, Singapore. Before joining NTU, he was involved in communications and signal processing research at Centre for Development of Advanced Computing (Electronics R&D Centre), Govt. of India and Institute for Infocomm Research (Centre for Wireless Communications), Singapore. Dr. Madhukumar is a senior member of IEEE.",Artificial intelligence and machine learning algorithms for communication systemsResource allocation and Interference management in communication systemsMulti-tier cellular architecture for future broadband systemsCognitive radio systems: algorithms and architecturesCooperative Radio Systems for Mobile multi-hop networksModulation and multiple access schemes for future broadband systemsAdvanced signal processing algorithms for future wireless communication systems,['High Altitude Platform based Relays for Hybrid FSO/RF Communication for Satellite Communication Systems'],http://www3.ntu.edu.sg/home/asmadhukumar/,0000-0002-8740-634X,https://www.scopus.com/authid/detail.uri?authorId=7003877769,https://dblp.org/pid/66/549.html,"<svg class=""histogram"" height=""60"" id=""yt-histogram"" viewBox=""0 0 250 60"" width=""250"" xmlns=""http://www.w3.org/2000/svg""><line stroke=""#505b62"" stroke-width=""1.0"" x1=""0.0"" x2=""230.0"" y1=""50.0"" y2=""50.0""/><text font-size=""xx-small"" x=""0.0"" y=""60.0"">1991</text><text font-size=""xx-small"" x=""110.0"" y=""60.0""/><text font-size=""xx-small"" x=""210.0"" y=""60.0"">2023</text><line stroke=""#aaaaaa"" stroke-dasharray=""2 4"" stroke-width=""0.5"" x1=""0.0"" x2=""230.0"" y1=""40.5"" y2=""40.5""/><line stroke=""#aaaaaa"" stroke-dasharray=""4 0"" stroke-width=""0.5"" x1=""0.0"" x2=""230.0"" y1=""29.9"" y2=""29.9""/><text fill=""#505b62"" font-size=""xx-small"" x=""230.0"" y=""33.2"">10</text><line stroke=""#aaaaaa"" stroke-dasharray=""2 4"" stroke-width=""0.5"" x1=""0.0"" x2=""230.0"" y1=""19.4"" y2=""19.4""/><rect fill=""#196ca3"" height=""2.1"" width=""6.0"" x=""0.0"" y=""47.9""><title>1991: 1</title></rect><rect fill=""#c32b72"" height=""2.1"" width=""6.0"" x=""13.9"" y=""47.9""><title>1993: 1</title></rect><rect fill=""#196ca3"" height=""4.2"" width=""6.0"" x=""62.7"" y=""45.8""><title>2000: 2</title></rect><rect fill=""#196ca3"" height=""4.2"" width=""6.0"" x=""69.7"" y=""45.8""><title>2001: 2</title></rect><rect fill=""#196ca3"" height=""6.3"" width=""6.0"" x=""76.7"" y=""43.7""><title>2002: 7</title></rect><rect fill=""#c32b72"" height=""8.4"" width=""6.0"" x=""76.7"" y=""35.3""><title>2002: 7</title></rect><rect fill=""#196ca3"" height=""16.8"" width=""6.0"" x=""83.6"" y=""33.2""><title>2003: 12</title></rect><rect fill=""#c32b72"" height=""8.4"" width=""6.0"" x=""83.6"" y=""24.7""><title>2003: 12</title></rect><rect fill=""#196ca3"" height=""6.3"" width=""6.0"" x=""90.6"" y=""43.7""><title>2004: 6</title></rect><rect fill=""#c32b72"" height=""6.3"" width=""6.0"" x=""90.6"" y=""37.4""><title>2004: 6</title></rect><rect fill=""#196ca3"" height=""6.3"" width=""6.0"" x=""97.6"" y=""43.7""><title>2005: 5</title></rect><rect fill=""#c32b72"" height=""4.2"" width=""6.0"" x=""97.6"" y=""39.5""><title>2005: 5</title></rect><rect fill=""#196ca3"" height=""10.5"" width=""6.0"" x=""104.5"" y=""39.5""><title>2006: 8</title></rect><rect fill=""#c32b72"" height=""6.3"" width=""6.0"" x=""104.5"" y=""33.2""><title>2006: 8</title></rect><rect fill=""#196ca3"" height=""16.8"" width=""6.0"" x=""111.5"" y=""33.2""><title>2007: 11</title></rect><rect fill=""#c32b72"" height=""6.3"" width=""6.0"" x=""111.5"" y=""26.8""><title>2007: 11</title></rect><rect fill=""#196ca3"" height=""6.3"" width=""6.0"" x=""118.5"" y=""43.7""><title>2008: 7</title></rect><rect fill=""#c32b72"" height=""8.4"" width=""6.0"" x=""118.5"" y=""35.3""><title>2008: 7</title></rect><rect fill=""#196ca3"" height=""10.5"" width=""6.0"" x=""125.5"" y=""39.5""><title>2009: 8</title></rect><rect fill=""#c32b72"" height=""6.3"" width=""6.0"" x=""125.5"" y=""33.2""><title>2009: 8</title></rect><rect fill=""#196ca3"" height=""16.8"" width=""6.0"" x=""132.4"" y=""33.2""><title>2010: 11</title></rect><rect fill=""#c32b72"" height=""6.3"" width=""6.0"" x=""132.4"" y=""26.8""><title>2010: 11</title></rect><rect fill=""#196ca3"" height=""12.6"" width=""6.0"" x=""139.4"" y=""37.4""><title>2011: 12</title></rect><rect fill=""#c32b72"" height=""12.6"" width=""6.0"" x=""139.4"" y=""24.7""><title>2011: 12</title></rect><rect fill=""#196ca3"" height=""14.7"" width=""6.0"" x=""146.4"" y=""35.3""><title>2012: 12</title></rect><rect fill=""#c32b72"" height=""10.5"" width=""6.0"" x=""146.4"" y=""24.7""><title>2012: 12</title></rect><rect fill=""#196ca3"" height=""4.2"" width=""6.0"" x=""153.3"" y=""45.8""><title>2013: 7</title></rect><rect fill=""#c32b72"" height=""10.5"" width=""6.0"" x=""153.3"" y=""35.3""><title>2013: 7</title></rect><rect fill=""#196ca3"" height=""12.6"" width=""6.0"" x=""160.3"" y=""37.4""><title>2014: 8</title></rect><rect fill=""#c32b72"" height=""4.2"" width=""6.0"" x=""160.3"" y=""33.2""><title>2014: 8</title></rect><rect fill=""#196ca3"" height=""8.4"" width=""6.0"" x=""167.3"" y=""41.6""><title>2015: 9</title></rect><rect fill=""#c32b72"" height=""10.5"" width=""6.0"" x=""167.3"" y=""31.1""><title>2015: 9</title></rect><rect fill=""#196ca3"" height=""8.4"" width=""6.0"" x=""174.2"" y=""41.6""><title>2016: 9</title></rect><rect fill=""#c32b72"" height=""10.5"" width=""6.0"" x=""174.2"" y=""31.1""><title>2016: 9</title></rect><rect fill=""#606b70"" height=""2.1"" width=""6.0"" x=""181.2"" y=""47.9""><title>2017: 14</title></rect><rect fill=""#196ca3"" height=""10.5"" width=""6.0"" x=""181.2"" y=""37.4""><title>2017: 14</title></rect><rect fill=""#c32b72"" height=""16.8"" width=""6.0"" x=""181.2"" y=""20.5""><title>2017: 14</title></rect><rect fill=""#196ca3"" height=""14.7"" width=""6.0"" x=""188.2"" y=""35.3""><title>2018: 12</title></rect><rect fill=""#c32b72"" height=""10.5"" width=""6.0"" x=""188.2"" y=""24.7""><title>2018: 12</title></rect><rect fill=""#606b70"" height=""4.2"" width=""6.0"" x=""195.2"" y=""45.8""><title>2019: 19</title></rect><rect fill=""#196ca3"" height=""12.6"" width=""6.0"" x=""195.2"" y=""33.2""><title>2019: 19</title></rect><rect fill=""#c32b72"" height=""23.2"" width=""6.0"" x=""195.2"" y=""10.0""><title>2019: 19</title></rect><rect fill=""#196ca3"" height=""14.7"" width=""6.0"" x=""202.1"" y=""35.3""><title>2020: 15</title></rect><rect fill=""#c32b72"" height=""16.8"" width=""6.0"" x=""202.1"" y=""18.4""><title>2020: 15</title></rect><rect fill=""#196ca3"" height=""2.1"" width=""6.0"" x=""209.1"" y=""47.9""><title>2021: 7</title></rect><rect fill=""#c32b72"" height=""12.6"" width=""6.0"" x=""209.1"" y=""35.3""><title>2021: 7</title></rect><rect fill=""#196ca3"" height=""8.4"" width=""6.0"" x=""223.0"" y=""41.6""><title>2023: 6</title></rect><rect fill=""#c32b72"" height=""4.2"" width=""6.0"" x=""223.0"" y=""37.4""><title>2023: 6</title></rect></svg>",2020-04-17,"['https://orcid.org/0000-0002-8740-634X', 'http://www.ntu.edu.sg/home/asmadhukumar/']",,"['Nanyang Technological University, Singapore']",7_AzrLwAAAAJ,https://scholar.googleusercontent.com/citations?view_op=view_photo&user=7_AzrLwAAAAJ&citpid=7,2907.0,1281.0,26.0,19.0,81.0,34.0,"{2002: 18, 2003: 10, 2004: 19, 2005: 53, 2006: 95, 2007: 91, 2008: 113, 2009: 96, 2010: 98, 2011: 125, 2012: 129, 2013: 142, 2014: 147, 2015: 132, 2016: 149, 2017: 154, 2018: 145, 2019: 190, 2020: 203, 2021: 264, 2022: 287, 2023: 187}"
1,Alexei Sourin,assourin@ntu.edu.sg,/cris/rp/rp00274,"['Computer Science and Engineering', 'Interactive Digital Media', 'Graphics and Interactive Computing', 'Smart Cities', 'Disruptive Technology and Materials', 'EdTech & Science Communication', 'Medical Technology', 'Smart Nation', 'Urban Planning and Human Centered Design', 'Solid modeling', 'Haptics', 'Virtual reality']","Dr. Alexei Sourin was born in Moscow and received his M.Eng. and Ph.D. degrees in computer graphics from the Moscow Engineering Physics Institute, Russia (MEPhI) in 1983 and 1988, respectively. From 1983 to 1993 he was a researcher at MEPhI where he worked on different scientific visualization and computer animation projects. Since 1993 he held faculty positions at Nanyang Technological University (NTU) in Singapore, except a period from 1999 to 2000 when he was Associate Professor at Moscow Institute of Physics and Technology (MIPT). Currently he is a tenured Associate Professor with the School of Computer Science and Engineering at NTU. His research interests are in shape modeling, multi-modal interaction, music visualization, and automated visual inspection in manufacturing. Dr. Sourin published over 230 referred research papers and was invited to give talks to many scientific events. Dr. Sourin is also one of the pioneers of electronic education in Singapore. From 2012 to 2018, he was a Chair of the IFIP WG5.10 Computer Graphics and Virtual Worlds. Dr. Sourin is a Senior Member of IEEE and a member of ACM SIGGRAPH. He is an associate editor of several international journals including The Visual Computer (Springer) and Transactions on Computational Science (Springer). He was on the program committees of over 120 international conferences. He is a coordinator of the International Conferences on Cyberworlds for which he was also General and Program Chair in many years.","Shape modeling, multi-modal interaction, new user interfaces, music visualization, automated visual inspection in manufacturing.",['Feasibility Study on Automatic Detection of Anomalies in Captured Images with Limited Training Data'],http://www3.ntu.edu.sg/home/assourin/,0000-0003-4051-2927,https://www.scopus.com/authid/detail.uri?authorId=8366154100,https://dblp.org/pid/15/3108.html,"<svg class=""histogram"" height=""60"" id=""yt-histogram"" viewBox=""0 0 250 60"" width=""250"" xmlns=""http://www.w3.org/2000/svg""><line stroke=""#505b62"" stroke-width=""1.0"" x1=""0.0"" x2=""230.0"" y1=""50.0"" y2=""50.0""/><text font-size=""xx-small"" x=""0.0"" y=""60.0"">1995</text><text font-size=""xx-small"" x=""110.0"" y=""60.0""/><text font-size=""xx-small"" x=""210.0"" y=""60.0"">2022</text><line stroke=""#aaaaaa"" stroke-dasharray=""2 4"" stroke-width=""0.5"" x1=""0.0"" x2=""230.0"" y1=""36.7"" y2=""36.7""/><line stroke=""#aaaaaa"" stroke-dasharray=""4 0"" stroke-width=""0.5"" x1=""0.0"" x2=""230.0"" y1=""22.4"" y2=""22.4""/><text fill=""#505b62"" font-size=""xx-small"" x=""230.0"" y=""25.7"">10</text><rect fill=""#196ca3"" height=""2.9"" width=""7.2"" x=""0.0"" y=""47.1""><title>1995: 2</title></rect><rect fill=""#c32b72"" height=""2.9"" width=""7.2"" x=""0.0"" y=""44.3""><title>1995: 2</title></rect><rect fill=""#c32b72"" height=""5.7"" width=""7.2"" x=""8.2"" y=""44.3""><title>1996: 2</title></rect><rect fill=""#196ca3"" height=""2.9"" width=""7.2"" x=""24.6"" y=""47.1""><title>1998: 1</title></rect><rect fill=""#196ca3"" height=""2.9"" width=""7.2"" x=""32.9"" y=""47.1""><title>1999: 1</title></rect><rect fill=""#196ca3"" height=""2.9"" width=""7.2"" x=""49.3"" y=""47.1""><title>2001: 3</title></rect><rect fill=""#c32b72"" height=""5.7"" width=""7.2"" x=""49.3"" y=""41.4""><title>2001: 3</title></rect><rect fill=""#196ca3"" height=""11.4"" width=""7.2"" x=""57.5"" y=""38.6""><title>2002: 4</title></rect><rect fill=""#196ca3"" height=""2.9"" width=""7.2"" x=""65.7"" y=""47.1""><title>2003: 1</title></rect><rect fill=""#196ca3"" height=""5.7"" width=""7.2"" x=""73.9"" y=""44.3""><title>2004: 4</title></rect><rect fill=""#c32b72"" height=""5.7"" width=""7.2"" x=""73.9"" y=""38.6""><title>2004: 4</title></rect><rect fill=""#196ca3"" height=""14.3"" width=""7.2"" x=""82.1"" y=""35.7""><title>2005: 5</title></rect><rect fill=""#196ca3"" height=""11.4"" width=""7.2"" x=""90.4"" y=""38.6""><title>2006: 9</title></rect><rect fill=""#c32b72"" height=""14.3"" width=""7.2"" x=""90.4"" y=""24.3""><title>2006: 9</title></rect><rect fill=""#33c3ba"" height=""2.9"" width=""7.2"" x=""98.6"" y=""47.1""><title>2007: 5</title></rect><rect fill=""#196ca3"" height=""5.7"" width=""7.2"" x=""98.6"" y=""41.4""><title>2007: 5</title></rect><rect fill=""#c32b72"" height=""5.7"" width=""7.2"" x=""98.6"" y=""35.7""><title>2007: 5</title></rect><rect fill=""#196ca3"" height=""5.7"" width=""7.2"" x=""106.8"" y=""44.3""><title>2008: 3</title></rect><rect fill=""#c32b72"" height=""2.9"" width=""7.2"" x=""106.8"" y=""41.4""><title>2008: 3</title></rect><rect fill=""#196ca3"" height=""14.3"" width=""7.2"" x=""115.0"" y=""35.7""><title>2009: 8</title></rect><rect fill=""#c32b72"" height=""8.6"" width=""7.2"" x=""115.0"" y=""27.1""><title>2009: 8</title></rect><rect fill=""#33c3ba"" height=""2.9"" width=""7.2"" x=""123.2"" y=""47.1""><title>2010: 8</title></rect><rect fill=""#196ca3"" height=""14.3"" width=""7.2"" x=""123.2"" y=""32.9""><title>2010: 8</title></rect><rect fill=""#c32b72"" height=""5.7"" width=""7.2"" x=""123.2"" y=""27.1""><title>2010: 8</title></rect><rect fill=""#33c3ba"" height=""2.9"" width=""7.2"" x=""131.4"" y=""47.1""><title>2011: 8</title></rect><rect fill=""#196ca3"" height=""11.4"" width=""7.2"" x=""131.4"" y=""35.7""><title>2011: 8</title></rect><rect fill=""#c32b72"" height=""8.6"" width=""7.2"" x=""131.4"" y=""27.1""><title>2011: 8</title></rect><rect fill=""#33c3ba"" height=""2.9"" width=""7.2"" x=""139.6"" y=""47.1""><title>2012: 7</title></rect><rect fill=""#196ca3"" height=""14.3"" width=""7.2"" x=""139.6"" y=""32.9""><title>2012: 7</title></rect><rect fill=""#c32b72"" height=""2.9"" width=""7.2"" x=""139.6"" y=""30.0""><title>2012: 7</title></rect><rect fill=""#196ca3"" height=""11.4"" width=""7.2"" x=""147.9"" y=""38.6""><title>2013: 8</title></rect><rect fill=""#c32b72"" height=""11.4"" width=""7.2"" x=""147.9"" y=""27.1""><title>2013: 8</title></rect><rect fill=""#196ca3"" height=""14.3"" width=""7.2"" x=""156.1"" y=""35.7""><title>2014: 6</title></rect><rect fill=""#c32b72"" height=""2.9"" width=""7.2"" x=""156.1"" y=""32.9""><title>2014: 6</title></rect><rect fill=""#196ca3"" height=""2.9"" width=""7.2"" x=""164.3"" y=""47.1""><title>2015: 2</title></rect><rect fill=""#c32b72"" height=""2.9"" width=""7.2"" x=""164.3"" y=""44.3""><title>2015: 2</title></rect><rect fill=""#33c3ba"" height=""8.6"" width=""7.2"" x=""172.5"" y=""41.4""><title>2016: 14</title></rect><rect fill=""#196ca3"" height=""20.0"" width=""7.2"" x=""172.5"" y=""21.4""><title>2016: 14</title></rect><rect fill=""#c32b72"" height=""11.4"" width=""7.2"" x=""172.5"" y=""10.0""><title>2016: 14</title></rect><rect fill=""#33c3ba"" height=""2.9"" width=""7.2"" x=""180.7"" y=""47.1""><title>2017: 8</title></rect><rect fill=""#196ca3"" height=""8.6"" width=""7.2"" x=""180.7"" y=""38.6""><title>2017: 8</title></rect><rect fill=""#c32b72"" height=""11.4"" width=""7.2"" x=""180.7"" y=""27.1""><title>2017: 8</title></rect><rect fill=""#33c3ba"" height=""5.7"" width=""7.2"" x=""188.9"" y=""44.3""><title>2018: 9</title></rect><rect fill=""#196ca3"" height=""11.4"" width=""7.2"" x=""188.9"" y=""32.9""><title>2018: 9</title></rect><rect fill=""#c32b72"" height=""8.6"" width=""7.2"" x=""188.9"" y=""24.3""><title>2018: 9</title></rect><rect fill=""#196ca3"" height=""8.6"" width=""7.2"" x=""197.1"" y=""41.4""><title>2019: 5</title></rect><rect fill=""#c32b72"" height=""5.7"" width=""7.2"" x=""197.1"" y=""35.7""><title>2019: 5</title></rect><rect fill=""#33c3ba"" height=""5.7"" width=""7.2"" x=""205.4"" y=""44.3""><title>2020: 6</title></rect><rect fill=""#196ca3"" height=""5.7"" width=""7.2"" x=""205.4"" y=""38.6""><title>2020: 6</title></rect><rect fill=""#c32b72"" height=""5.7"" width=""7.2"" x=""205.4"" y=""32.9""><title>2020: 6</title></rect><rect fill=""#33c3ba"" height=""2.9"" width=""7.2"" x=""213.6"" y=""47.1""><title>2021: 7</title></rect><rect fill=""#196ca3"" height=""11.4"" width=""7.2"" x=""213.6"" y=""35.7""><title>2021: 7</title></rect><rect fill=""#c32b72"" height=""2.9"" width=""7.2"" x=""213.6"" y=""32.9""><title>2021: 7</title></rect><rect fill=""#f8c91f"" height=""2.9"" width=""7.2"" x=""213.6"" y=""30.0""><title>2021: 7</title></rect><rect fill=""#33c3ba"" height=""2.9"" width=""7.2"" x=""221.8"" y=""47.1""><title>2022: 5</title></rect><rect fill=""#196ca3"" height=""5.7"" width=""7.2"" x=""221.8"" y=""41.4""><title>2022: 5</title></rect><rect fill=""#c32b72"" height=""5.7"" width=""7.2"" x=""221.8"" y=""35.7""><title>2022: 5</title></rect></svg>",2021-04-28,"['http://www.ntu.edu.sg/home/assourin/', 'https://dl.acm.org/profile/81410593685']",,"['Nanyang Technological University, Singapore']",8A7kHCYAAAAJ,https://scholar.googleusercontent.com/citations?view_op=view_photo&user=8A7kHCYAAAAJ&citpid=5,2939.0,856.0,27.0,13.0,63.0,18.0,"{1995: 9, 1996: 16, 1997: 24, 1998: 27, 1999: 37, 2000: 38, 2001: 60, 2002: 84, 2003: 54, 2004: 84, 2005: 95, 2006: 98, 2007: 115, 2008: 128, 2009: 153, 2010: 144, 2011: 144, 2012: 107, 2013: 141, 2014: 142, 2015: 100, 2016: 94, 2017: 120, 2018: 122, 2019: 122, 2020: 116, 2021: 169, 2022: 192, 2023: 134}"
