62,Smitha K G,smitha@ntu.edu.sg,/cris/rp/rp00612,"['Computer Science and Engineering', 'Electrical and Electronic Engineering', 'Machines & Systems', 'Microelectronics & Applications', 'Brain Machine Interface', 'Circuits and Systems in Signal Processing', 'Computer Arithmetic', 'Cognitive radios.']","Dr. Smitha, is a Senior Lecturer at School of Computer Science and Engineering (SCSE) in Nanyang Technological University (NTU).Her main research interests are in the areas of low complexity and high speed DSP circuits computer arithmetic, cognitive radio and signal processing for brain-computer interface.","VLSI designDigital Signal Processing,Biomedical Signal ProcessingBrain-machine Interface-algorithms and applications,Low Power Reconfigurable signal processing circuits for Cognitive RadioComputer Arithmetic",[],https://personal.ntu.edu.sg/smitha/,0000-0002-0401-2960,,https://dblp.org/pid/73/4788.html,"<svg class=""histogram"" height=""60"" id=""yt-histogram"" viewBox=""0 0 250 60"" width=""250"" xmlns=""http://www.w3.org/2000/svg""><line stroke=""#505b62"" stroke-width=""1.0"" x1=""0.0"" x2=""230.0"" y1=""50.0"" y2=""50.0""/><text font-size=""xx-small"" x=""0.0"" y=""60.0"">2006</text><text font-size=""xx-small"" x=""110.0"" y=""60.0""/><text font-size=""xx-small"" x=""210.0"" y=""60.0"">2021</text><line stroke=""#aaaaaa"" stroke-dasharray=""2 4"" stroke-width=""0.5"" x1=""0.0"" x2=""230.0"" y1=""11.0"" y2=""11.0""/><text fill=""#505b62"" font-size=""xx-small"" x=""230.0"" y=""14.3"">5</text><rect fill=""#196ca3"" height=""8.0"" width=""13.4"" x=""0.0"" y=""42.0""><title>2006: 1</title></rect><rect fill=""#196ca3"" height=""8.0"" width=""13.4"" x=""14.4"" y=""42.0""><title>2007: 1</title></rect><rect fill=""#196ca3"" height=""16.0"" width=""13.4"" x=""28.8"" y=""34.0""><title>2008: 3</title></rect><rect fill=""#c32b72"" height=""8.0"" width=""13.4"" x=""28.8"" y=""26.0""><title>2008: 3</title></rect><rect fill=""#c32b72"" height=""16.0"" width=""13.4"" x=""43.1"" y=""34.0""><title>2009: 2</title></rect><rect fill=""#196ca3"" height=""8.0"" width=""13.4"" x=""57.5"" y=""42.0""><title>2010: 2</title></rect><rect fill=""#f8c91f"" height=""8.0"" width=""13.4"" x=""57.5"" y=""34.0""><title>2010: 2</title></rect><rect fill=""#196ca3"" height=""8.0"" width=""13.4"" x=""71.9"" y=""42.0""><title>2011: 2</title></rect><rect fill=""#c32b72"" height=""8.0"" width=""13.4"" x=""71.9"" y=""34.0""><title>2011: 2</title></rect><rect fill=""#196ca3"" height=""16.0"" width=""13.4"" x=""86.2"" y=""34.0""><title>2012: 5</title></rect><rect fill=""#c32b72"" height=""24.0"" width=""13.4"" x=""86.2"" y=""10.0""><title>2012: 5</title></rect><rect fill=""#196ca3"" height=""24.0"" width=""13.4"" x=""100.6"" y=""26.0""><title>2013: 4</title></rect><rect fill=""#c32b72"" height=""8.0"" width=""13.4"" x=""100.6"" y=""18.0""><title>2013: 4</title></rect><rect fill=""#196ca3"" height=""16.0"" width=""13.4"" x=""115.0"" y=""34.0""><title>2014: 4</title></rect><rect fill=""#c32b72"" height=""16.0"" width=""13.4"" x=""115.0"" y=""18.0""><title>2014: 4</title></rect><rect fill=""#196ca3"" height=""16.0"" width=""13.4"" x=""129.4"" y=""34.0""><title>2015: 4</title></rect><rect fill=""#c32b72"" height=""16.0"" width=""13.4"" x=""129.4"" y=""18.0""><title>2015: 4</title></rect><rect fill=""#196ca3"" height=""16.0"" width=""13.4"" x=""143.8"" y=""34.0""><title>2016: 2</title></rect><rect fill=""#196ca3"" height=""8.0"" width=""13.4"" x=""158.1"" y=""42.0""><title>2017: 1</title></rect><rect fill=""#196ca3"" height=""24.0"" width=""13.4"" x=""172.5"" y=""26.0""><title>2018: 3</title></rect><rect fill=""#196ca3"" height=""32.0"" width=""13.4"" x=""186.9"" y=""18.0""><title>2019: 4</title></rect><rect fill=""#196ca3"" height=""8.0"" width=""13.4"" x=""201.2"" y=""42.0""><title>2020: 1</title></rect><rect fill=""#c32b72"" height=""16.0"" width=""13.4"" x=""215.6"" y=""34.0""><title>2021: 2</title></rect></svg>",2021-03-30,"['http://www.ntu.edu.sg/home/smitha/', 'https://orcid.org/0000-0002-0401-2960']","['Kavallur Gopi Smitha', 'Kavallur Pisharath G. Smitha', 'Smitha K. G.', 'K. G. Smitha', 'Smitha Kavallur Pisharath Gopi']","['Senior Lecturer, Nanyang Technological University']",9mD7MHgAAAAJ,https://scholar.googleusercontent.com/citations?view_op=view_photo&user=9mD7MHgAAAAJ&citpid=1,782.0,467.0,17.0,11.0,25.0,14.0,"{2009: 7, 2010: 11, 2011: 8, 2012: 22, 2013: 32, 2014: 52, 2015: 35, 2016: 75, 2017: 64, 2018: 66, 2019: 73, 2020: 74, 2021: 97, 2022: 98, 2023: 58}"
63,Sourav Saha Bhowmick,assourav@ntu.edu.sg,/cris/rp/rp00915,"['Computer Science and Engineering', 'Art, Design and Media', 'Sociology', 'Biomedical Sciences & Life Sciences', 'Data Management', 'Human-Data Interaction', 'Graph Databases', 'Data Analytics', 'Computational Social Science']","Sourav S Bhowmick is a computer scientist and an educator. He leads the Data Management Research Group at NTU (DANTE). He is also the Research Group Lead of Data Management & Analytics Group in SCSE. He was a Visiting Associate Professor from 2007 to 2013 at the Biological Engineering Division, Massachusetts Institute of Technology (MIT), USA. He was a Senior Visiting Professor at Fudan University in 2013. He was inducted into Distinguished Members of the ACM in 2020 for ""outstanding scientific contributions to computing"". Sourav’s core research expertise is in data management, human-data interaction, and data analytics. He is more excited to solving problems not within the mainstream of these fields that require new perspectives instead of yet another solution to a traditional problem. Consequently, his research interests are multi-area (e.g., data management and HCI, data management and IR) and multi-disciplinary (e.g., system biology and data analytics, social psychology and data analytics, cognitive psychology and data management, abstract art and social analytics, adult learning and data management) in flavor, focusing primarily on developing novel paradigms, algorithms, technology, and software to improve efficiency of software as well as humans. Sourav has published more than 100 papers in top-tier data management, data mining, multimedia, bioinformatics, and systems biology venues such as ACM SIGMOD, VLDB, ACM WWW, ACM MM, ACM SIGIR, VLDB Journal, Bioinformatics, and Biophysical Journal. The common thread running through his research is a focus on going beyond papers to build usable novel prototypes. He has received Best Paper Awards at ACM CIKM 2004 and ACM BCB 2011 for papers related to evolution mining and biological network summarization, respectively. His work on influence maximization was nominated for the best paper award in SIGMOD 2015. He has co-authored books on “Summarizing Biological Networks” and “Human Interaction with Graphs”, which are published by Springer-Verlag (May 2017) and Morgan & Claypool (August 2018) publishers, respectively. His research is supported by over S$4M in research grant from the Singapore-MIT Alliance and the Ministry of Education (4 Tier 2s, 6 Tier 1s). Sourav's research has been deployed in the real-world. His XML data management framework for biological data was part of the product of a local startup HeliXense Pte Ltd in 2002. More recently, his data-driven conflicts of interest (COI) detection system called CLOSET is being used by several premium conferences. Sourav regularly serves as a reviewer for premium data management and data analytics conferences (e.g., SIGMOD, VLDB) and journals (e.g., TODS, VLDB Journal). He has served/serving as a program chair/co-chair of several venues including ACM CIKM 2020, IEEE BigComp 2018, DASFAA 2014. He has also served/serving as Group Leader (area chair) for VLDB 2022, SIGMOD 2021, ICDE 2021, and SIGMOD 2019. He is a member of the steering committee of DASFAA. Sourav has been panelist, tutorial and keynote speaker in several international conferences (including SIGMOD, VLDB). He has also been reviewer of external Ph.D dissertations, national and international grant proposals, and external tenure applications. He is a member of the editorial boards of several international journals (e.g., IEEE TKDE, JASIST, SIGMOD Record). He is a co-recipient of the ""VLDB Service Award"" in 2018 from the VLDB Endowment for his contribution in designing an efficient PVLDB proceedings management framework. He is also conferred ""Distinguished PVLDB2020 Review Board Member Award"" in 2020 for ""outstanding services to VLDB 2020 and data management community"". Sourav have strong interest and passion for teaching undergraduate and graduate students. He was nominated for the Excellence in Teaching Award in 2020, 2005, 2004, and 2003. He was recipient of Lecturer of the Year Award (2002-2003) for Year 1 undergraduate course. Sourav have been invited twice (2011 and 2013) by the Database Society of Japan to mentor graduate students.","Data management, human-data interaction, data analytics, network biology, computational social science, data-driven adult learning.",['Towards Data-driven Disambiguation of Homonymous Names in DBLP: A 30-Year-Old Notoriously Hard Challenge'],http://www3.ntu.edu.sg/home/assourav/,0000-0003-1957-8016,https://www.scopus.com/authid/detail.uri?authorId=7006796096,https://dblp.org/pid/b/SSBhowmick.html,"<svg class=""histogram"" height=""60"" id=""yt-histogram"" viewBox=""0 0 250 60"" width=""250"" xmlns=""http://www.w3.org/2000/svg""><line stroke=""#505b62"" stroke-width=""1.0"" x1=""0.0"" x2=""230.0"" y1=""50.0"" y2=""50.0""/><text font-size=""xx-small"" x=""0.0"" y=""60.0"">2013</text><text font-size=""xx-small"" x=""110.0"" y=""60.0""/><text font-size=""xx-small"" x=""210.0"" y=""60.0"">2023</text><line stroke=""#aaaaaa"" stroke-dasharray=""2 4"" stroke-width=""0.5"" x1=""0.0"" x2=""230.0"" y1=""11.0"" y2=""11.0""/><text fill=""#505b62"" font-size=""xx-small"" x=""230.0"" y=""14.3"">5</text></svg>",2022-08-16,"['http://www.ntu.edu.sg/home/assourav/', 'https://sites.google.com/view/souravsarts/home', 'https://scholar.google.com/citations?user=o0F3sqEAAAAJ', 'https://twitter.com/rockinsourav', 'https://orcid.org/0000-0003-1957-8016', 'https://personal.ntu.edu.sg/assourav/']",,"['Nanyang Technological University, Singapore', 'ACM Distinguished Member, Associate Professor, Nanyang Technological University']",o0F3sqEAAAAJ,https://scholar.googleusercontent.com/citations?view_op=view_photo&user=o0F3sqEAAAAJ&citpid=17,5879.0,1988.0,38.0,21.0,136.0,54.0,"{1998: 45, 1999: 61, 2000: 55, 2001: 28, 2002: 51, 2003: 110, 2004: 109, 2005: 208, 2006: 207, 2007: 181, 2008: 197, 2009: 194, 2010: 223, 2011: 239, 2012: 283, 2013: 287, 2014: 331, 2015: 326, 2016: 301, 2017: 350, 2018: 339, 2019: 281, 2020: 275, 2021: 376, 2022: 374, 2023: 343}"
64,Sun Aixin,axsun@ntu.edu.sg,/cris/rp/rp00552,"['Computational Intelligence', 'Information Sciences and Systems', 'Information Retrieval', 'Text Mining', 'Recommender Systems']","Dr. Sun Aixin is an Associate Professor and Assistant Chair (Academic) at the School of Computer Science and Engineering (SCSE), Nanyang Technological University (NTU), Singapore. He has been a faculty member of SCSE since 2005 and was the Assistant Chair (Admissions and Outreach) from 2016 to 2020. He is a member of Singapore Data Science Consortium (SDSC) Technical Committee, and SDSC institution representative of NTU. His current research interests include information retrieval, text mining, social computing, and digital libraries.Dr. Sun received B.A.Sc (1st class honours) and Ph.D. both in Computer Engineering from NTU in 2001 and 2004 respectively. He has published about 200 papers in major international journals and conferences. According to Google Scholar, his papers have received more than 13,000 citations, with h-index above 50.Dr. Sun is an associate editor of Neurocomputing, editorial board member of Journal of the Association for Information Science and Technology (JASIST), and editorial board member of Information Retrieval Journal. He has served as the demonstration track co-chair for SIGIR2020, ICDM2018, CIKM2017, PC co-chair for AIRS2019, and general chair for ADMA2017. He was a member of the best paper committee for SIGIR2020. He has also served as Area Chair, Senior PC member or PC member for many conferences including SIGIR, WWW, WSDM, EMNLP, AAAI, and IJCAI.",Information Retrieval; Text/Web Mining; Social Computing; Multimedia,['Geography of Fake News: Misinformation Spreading and Implication for Capital Markets'],https://personal.ntu.edu.sg/axsun,0000-0003-0764-4258,https://www.scopus.com/authid/detail.uri?authorId=7202552214,https://dblp.org/pid/78/5155.html,"<svg class=""histogram"" height=""60"" id=""yt-histogram"" viewBox=""0 0 250 60"" width=""250"" xmlns=""http://www.w3.org/2000/svg""><line stroke=""#505b62"" stroke-width=""1.0"" x1=""0.0"" x2=""230.0"" y1=""50.0"" y2=""50.0""/><text font-size=""xx-small"" x=""0.0"" y=""60.0"">2013</text><text font-size=""xx-small"" x=""110.0"" y=""60.0""/><text font-size=""xx-small"" x=""210.0"" y=""60.0"">2023</text><line stroke=""#aaaaaa"" stroke-dasharray=""2 4"" stroke-width=""0.5"" x1=""0.0"" x2=""230.0"" y1=""11.0"" y2=""11.0""/><text fill=""#505b62"" font-size=""xx-small"" x=""230.0"" y=""14.3"">5</text></svg>",2023-07-17,"['http://www.ntu.edu.sg/home/AXSun/', 'https://scholar.google.com/citations?user=wyKGVKUAAAAJ', 'https://dl.acm.org/profile/81100446994', 'https://orcid.org/0000-0003-0764-4258', 'https://www.wikidata.org/entity/Q57696160', 'https://www.researcherid.com/rid/A-9852-2008', 'https://d-nb.info/gnd/14015423X']",,"['Nanyang Technological University, Singapore', 'NTU Singapore']",wyKGVKUAAAAJ,https://scholar.googleusercontent.com/citations?view_op=view_photo&user=wyKGVKUAAAAJ&citpid=17,17059.0,11311.0,59.0,47.0,159.0,119.0,"{2005: 69, 2006: 128, 2007: 122, 2008: 152, 2009: 229, 2010: 280, 2011: 362, 2012: 393, 2013: 421, 2014: 597, 2015: 799, 2016: 943, 2017: 1033, 2018: 1241, 2019: 1536, 2020: 1906, 2021: 2186, 2022: 2470, 2023: 1957}"
65,Tan Rui,tanrui@ntu.edu.sg,/cris/rp/rp00504,"['Computer Science and Engineering', 'Info-Communication Technology', 'Energy', 'Internet & Communications', 'Computer Networks and Communications', 'Sensing', 'security', 'Internet of Things', 'cyber-physical systems']","Rui Tan received B.S.(2004) and M.S.(2007) in automation from Shanghai Jiao Tong University, and Ph.D.(2010) in computer science from City University of Hong Kong, respectively. From 2010 to 2012, he worked as a postdoctoral Research Associate at Michigan State University. From 2012 to 2015, he worked as a Research Scientist and then a Senior Research Scientist at Advanced Digital Sciences Center, a Singapore-based research center of the University of Illinois at Urbana-Champaign. He joined the School of Computer Science and Engineering (SCSE) of Nanyang Technological University (NTU) in 2016. He is currently an Associate Professor with SCSE, NTU.He has received multiple research awards including Best Paper Award from ACM/IEEE IPSN 2017, CPSR-SG 2017, Distinguished TPC Member of INFOCOM 2017, Best Paper Award Runner-Ups from ACM/IEEE IPSN 2014 and IEEE PerCom 2013, IPSN'21 Best Artifact Award Runner-Up, as well as Outstanding Academic Performance Award from City University of Hong Kong in 2009. He is now an IEEE Senior Member.","I am interested in understanding how the physical ambients affect the cyber systems (e.g., sensor networks, wearables, data centers, etc) and exploiting certain properties of the physical ambients to improve the performance and resilience of the cyber systems. My ongoing research topics include:- AIoT (AI + IoT)- Sensing for resilient system functions (e.g., timing, synchronization, location, etc)- Thermal and energy management in data centers- Secure sensing and control in smart grids","['Build CSI based wireless sensing platforms with commodity WiFi', 'Data-driven Traffic Analytics and Simulation for Incident Impact Analysis and Management', 'Food Supply Chain Management built with Blockchain and Internet-of-Things (IoT)', 'Holistic Moving Target Defence for Autonomous Driving Perception', 'Intelligent Data Aggregation Framework for Workflow Optimisation in Smart Facility Management Solutions', 'Physics-Guided Generalization of AIoT Sensing', 'Sustainable Tropical Data Centre Test bed', 'Sustainable Tropical Data Centre Test bed (WP1)']",https://personal.ntu.edu.sg/tanrui/,0000-0001-8441-9973,,https://dblp.org/pid/00/5179.html,"<svg class=""histogram"" height=""60"" id=""yt-histogram"" viewBox=""0 0 250 60"" width=""250"" xmlns=""http://www.w3.org/2000/svg""><line stroke=""#505b62"" stroke-width=""1.0"" x1=""0.0"" x2=""230.0"" y1=""50.0"" y2=""50.0""/><text font-size=""xx-small"" x=""0.0"" y=""60.0"">2006</text><text font-size=""xx-small"" x=""110.0"" y=""60.0""/><text font-size=""xx-small"" x=""210.0"" y=""60.0"">2023</text><line stroke=""#aaaaaa"" stroke-dasharray=""2 4"" stroke-width=""0.5"" x1=""0.0"" x2=""230.0"" y1=""44.5"" y2=""44.5""/><line stroke=""#aaaaaa"" stroke-dasharray=""4 0"" stroke-width=""0.5"" x1=""0.0"" x2=""230.0"" y1=""38.1"" y2=""38.1""/><line stroke=""#aaaaaa"" stroke-dasharray=""2 4"" stroke-width=""0.5"" x1=""0.0"" x2=""230.0"" y1=""31.6"" y2=""31.6""/><line stroke=""#aaaaaa"" stroke-dasharray=""4 0"" stroke-width=""0.5"" x1=""0.0"" x2=""230.0"" y1=""25.2"" y2=""25.2""/><line stroke=""#aaaaaa"" stroke-dasharray=""2 4"" stroke-width=""0.5"" x1=""0.0"" x2=""230.0"" y1=""18.7"" y2=""18.7""/><line stroke=""#aaaaaa"" stroke-dasharray=""4 0"" stroke-width=""0.5"" x1=""0.0"" x2=""230.0"" y1=""12.3"" y2=""12.3""/><text fill=""#505b62"" font-size=""xx-small"" x=""230.0"" y=""15.6"">30</text><rect fill=""#196ca3"" height=""1.3"" width=""11.8"" x=""0.0"" y=""48.7""><title>2006: 1</title></rect><rect fill=""#196ca3"" height=""2.6"" width=""11.8"" x=""25.6"" y=""47.4""><title>2008: 2</title></rect><rect fill=""#196ca3"" height=""2.6"" width=""11.8"" x=""38.3"" y=""47.4""><title>2009: 2</title></rect><rect fill=""#196ca3"" height=""6.5"" width=""11.8"" x=""51.1"" y=""43.5""><title>2010: 8</title></rect><rect fill=""#c32b72"" height=""3.9"" width=""11.8"" x=""51.1"" y=""39.7""><title>2010: 8</title></rect><rect fill=""#c32b72"" height=""2.6"" width=""11.8"" x=""63.9"" y=""47.4""><title>2011: 2</title></rect><rect fill=""#196ca3"" height=""3.9"" width=""11.8"" x=""76.7"" y=""46.1""><title>2012: 6</title></rect><rect fill=""#c32b72"" height=""3.9"" width=""11.8"" x=""76.7"" y=""42.3""><title>2012: 6</title></rect><rect fill=""#196ca3"" height=""5.2"" width=""11.8"" x=""89.4"" y=""44.8""><title>2013: 8</title></rect><rect fill=""#c32b72"" height=""5.2"" width=""11.8"" x=""89.4"" y=""39.7""><title>2013: 8</title></rect><rect fill=""#196ca3"" height=""5.2"" width=""11.8"" x=""102.2"" y=""44.8""><title>2014: 6</title></rect><rect fill=""#c32b72"" height=""2.6"" width=""11.8"" x=""102.2"" y=""42.3""><title>2014: 6</title></rect><rect fill=""#196ca3"" height=""5.2"" width=""11.8"" x=""115.0"" y=""44.8""><title>2015: 6</title></rect><rect fill=""#c32b72"" height=""2.6"" width=""11.8"" x=""115.0"" y=""42.3""><title>2015: 6</title></rect><rect fill=""#606b70"" height=""1.3"" width=""11.8"" x=""127.8"" y=""48.7""><title>2016: 9</title></rect><rect fill=""#196ca3"" height=""7.7"" width=""11.8"" x=""127.8"" y=""41.0""><title>2016: 9</title></rect><rect fill=""#c32b72"" height=""2.6"" width=""11.8"" x=""127.8"" y=""38.4""><title>2016: 9</title></rect><rect fill=""#606b70"" height=""5.2"" width=""11.8"" x=""140.6"" y=""44.8""><title>2017: 20</title></rect><rect fill=""#196ca3"" height=""14.2"" width=""11.8"" x=""140.6"" y=""30.6""><title>2017: 20</title></rect><rect fill=""#c32b72"" height=""6.5"" width=""11.8"" x=""140.6"" y=""24.2""><title>2017: 20</title></rect><rect fill=""#606b70"" height=""3.9"" width=""11.8"" x=""153.3"" y=""46.1""><title>2018: 12</title></rect><rect fill=""#196ca3"" height=""6.5"" width=""11.8"" x=""153.3"" y=""39.7""><title>2018: 12</title></rect><rect fill=""#c32b72"" height=""5.2"" width=""11.8"" x=""153.3"" y=""34.5""><title>2018: 12</title></rect><rect fill=""#606b70"" height=""11.6"" width=""11.8"" x=""166.1"" y=""38.4""><title>2019: 31</title></rect><rect fill=""#196ca3"" height=""16.8"" width=""11.8"" x=""166.1"" y=""21.6""><title>2019: 31</title></rect><rect fill=""#c32b72"" height=""11.6"" width=""11.8"" x=""166.1"" y=""10.0""><title>2019: 31</title></rect><rect fill=""#606b70"" height=""10.3"" width=""11.8"" x=""178.9"" y=""39.7""><title>2020: 22</title></rect><rect fill=""#196ca3"" height=""6.5"" width=""11.8"" x=""178.9"" y=""33.2""><title>2020: 22</title></rect><rect fill=""#c32b72"" height=""11.6"" width=""11.8"" x=""178.9"" y=""21.6""><title>2020: 22</title></rect><rect fill=""#606b70"" height=""2.6"" width=""11.8"" x=""191.7"" y=""47.4""><title>2021: 22</title></rect><rect fill=""#196ca3"" height=""14.2"" width=""11.8"" x=""191.7"" y=""33.2""><title>2021: 22</title></rect><rect fill=""#c32b72"" height=""11.6"" width=""11.8"" x=""191.7"" y=""21.6""><title>2021: 22</title></rect><rect fill=""#606b70"" height=""5.2"" width=""11.8"" x=""204.4"" y=""44.8""><title>2022: 21</title></rect><rect fill=""#196ca3"" height=""9.0"" width=""11.8"" x=""204.4"" y=""35.8""><title>2022: 21</title></rect><rect fill=""#c32b72"" height=""12.9"" width=""11.8"" x=""204.4"" y=""22.9""><title>2022: 21</title></rect><rect fill=""#606b70"" height=""2.6"" width=""11.8"" x=""217.2"" y=""47.4""><title>2023: 17</title></rect><rect fill=""#196ca3"" height=""9.0"" width=""11.8"" x=""217.2"" y=""38.4""><title>2023: 17</title></rect><rect fill=""#c32b72"" height=""10.3"" width=""11.8"" x=""217.2"" y=""28.1""><title>2023: 17</title></rect></svg>",2009-06-10,['http://personal.ntu.edu.sg/tanrui'],,"['Associate Professor, Nanyang Technological University']",co5MGPkAAAAJ,https://scholar.googleusercontent.com/citations?view_op=view_photo&user=co5MGPkAAAAJ&citpid=4,4277.0,2915.0,35.0,29.0,92.0,73.0,"{2009: 17, 2010: 63, 2011: 85, 2012: 110, 2013: 149, 2014: 184, 2015: 221, 2016: 246, 2017: 232, 2018: 251, 2019: 360, 2020: 455, 2021: 549, 2022: 737, 2023: 562}"
